{
  "observer_message_id": "83000000-0000-4000-8000-000000000002",
  "payload_digest": "bbbbbbbbbbbbbbbbbbbbbbbbbbbbbbbbbbbbbbbbbbbbbbbbbbbbbbbbbbbbbbbb",
  "connector_sequence": 42,
  "observer_message_type": "session.event",
  "profile": "default",
  "session_key": "session-root-1",
  "runtime_generation": "runtime-20260731-01",
  "runtime_session_id": "runtime-session-1",
  "event_sequence": 107,
  "reason": "event_gap",
  "expected_event_sequence": 106,
  "recovery": "send_snapshot",
  "rejected_at": "2026-07-31T09:00:02Z"
}
